キャラ名,グレード,スタイル名,スキル1,スキル2,スキル3,アビリティ1,アビリティ2,アビリティ3
ヴァッハ神,SS,目立っちゃうわね,発火領域,石熱連破,夜空の大輪,今は楽しもう,ドーンと弾けて！,超充の戦技Ⅶ＆練気Ⅳ・Ⅲ
ジニー,SS,海のアニマ気持ちいい,召厳＋,ピースシールド,ビーチダンプリング,水中のアニマを感じて,エレメントフィールド(打・突),攻援の戦技Ⅵ＆決意Ⅲ・Ⅴ
ヒューズ,SS,サボってるんじゃない,スリルボルト,雷粒子マグナム,イカ焼きショット,買い食いも仕事のうち,ウェポンフィールドⅥ(銃),攻援の戦技Ⅵ& 練気Ⅵ・Ⅱ
ヒルダ,SS,この海が繋がる先は,烈光八重奏,真夏の閃光,ペルフォラシオンキンセ,波打ち際の女剣士,エレメントボルテージ(突・陽),小剣の極み・真Ⅶ＆練気Ⅹ・Ⅵ
フォルミナ,SS,大人げ無いけれど,スウィッチ,夏祭りショット,希望の銃声,おもちゃでも真剣,フォートレスフィールド,攻援の戦技Ⅵ＆練気Ⅲ・Ⅳ
マカ,SS,目標百周,追突剣＋,夏祭り音頭剣,桜花吹雪,祭りの舞姫,ヴァリアントフィールド,剣の極み・真Ⅶ＆練気Ⅴ・Ⅴ
ミリアム,SS,花火には負けないわ,灼光,橙炎輝,ファイアワークスソーサリー,花火には負けない,熱陽激化Ⅵ(知力・精神),杖の極み・真Ⅶ＆練気Ⅶ・Ⅳ
モニカ,SS,あなたの為の水着です,陽光矢雨,アクロバットアロー,バカンスフラワーアロー,はじめての水着,共鳴領域(突・陽),攻援の戦技Ⅵ＆練気Ⅳ・Ⅲ
ライザ,SS,金魚一匹じゃね－,メテオフォールドライバー,クアトロランブル,お祭り大乱闘,金魚キャッチャー・ライザ,打撃激化Ⅵ(腕力・素早さ),闘援の戦技Ⅴ・Ⅰ＆練気Ⅶ・Ⅲ
